entity_a,entity_b,shared_neighbor_count,shared_neighbors,priority_score
Hillary Clinton,Jack Goldberger,7,Sarah Kellen; Virginia Giuffre; Scott W. Rothstein; Kenneth Starr; Alan Dershowitz; Jeffrey Epstein; unknown minor,1218
Ehud Barak,Edward Snowden,7,Barack Obama; Vladimir Putin; United States Of America; China; Unknown Saudi journalist; Jeffrey Epstein; Israel,1218
United States Of America,Ehud Olmert,9,Unknown Israeli political leader; George H.W. Bush; Bashar al-Assad; Shimon Peres; Alan Dershowitz; Ehud Barak; Jeffrey Epstein; Israel; Benjamin Netanyahu,1215
Sarah Kellen,Sigrid McCawley,9,Joseph Recarey; Virginia Giuffre; Bradley Edwards; Hillary Clinton; Court; Alan Dershowitz; Jeffrey Epstein; Ghislaine Maxwell; Jack Scarola,1215
Trump,Andrea Mitrovich,4,Larry Visoski; Jeffrey Epstein; Hillary Clinton; Ghislaine Maxwell,1212
Virginia Giuffre,Alexander Rossmiller,10,Richard Berman; Alison J. Nathan; Amanda C. Kracen; Jeffrey S. Pagliuca; Stanley Pottinger; Laura Menninger; Sigrid McCawley; David Boies; Jeffrey Epstein; Ghislaine Maxwell,1210
Trump,Gary Roxburgh,4,Jeffrey Epstein; Virginia Giuffre; Ghislaine Maxwell; Eva Dubin,1208
Jeffrey S. Pagliuca,Audrey Strauss,17,Alison J. Nathan; Paul A. Engel Mayer; Richard Berman; Alexander Rossmiller; Maurene Ryan Coney; David Oscar Markus; Christian R. Everdell; Lara Elizabeth Pomerantz; Damian Williams; Andrew Rohrbach,1207
United States Of America,Hezbollah,9,Unknown Israeli political leader; Ayatollah Ali Khamenei; Syria; Iran; Bashar al-Assad; Shimon Peres; Ehud Barak; Kingdom of Saudi Arabia; Israel,1206
Trump,Cindy Lopez (Buklarewicz),4,David Rodriguez; Jeffrey Epstein; Hillary Clinton; Ghislaine Maxwell,1200
Trump,Brent Tindall (Chef),4,Larry Visoski; Jeffrey Epstein; Ghislaine Maxwell; Eva Dubin,1200
Barack Obama,Bradley Edwards,6,United States Of America; Hillary Clinton; Alan Dershowitz; Jeffrey Epstein; Ghislaine Maxwell; Trump,1200
Hillary Clinton,Joseph Recarey,7,underage girl; David Rodriguez; Sarah Kellen; Sigrid McCawley; Alan Dershowitz; Jeffrey Epstein; Ghislaine Maxwell,1197
Barack Obama,United States Attorney's Office,9,Patient Protection and Affordable Care Act; Iran; Kevin G. Nealer; Alan Dershowitz; Osama bin Laden; Edward Snowden; Jeffrey Epstein; Ghislaine Maxwell; American Recovery and Reinvestment Act,1197
Ehud Barak,Sarah Kellen,6,Jean-Luc Brunel; Larry Visoski; Hillary Clinton; Jeffrey Epstein; Ghislaine Maxwell; Larry Summers,1194
Trump,David Oscar Markus,4,Gloria Allred; Reid Weingarten; Jeffrey Epstein; Ghislaine Maxwell,1192
Trump,Teala Davies,4,Larry Visoski; Jeffrey Epstein; Ghislaine Maxwell; Eva Dubin,1192
Hillary Clinton,Russia,7,Barack Obama; Syria; United States Of America; Iran; Sergey Lavrov; Jeffrey Epstein; Trump,1190
Barack Obama,Richard Kahn,7,Clarisse Thorn; Hillary Clinton; Alan Dershowitz; Lawrence Krauss; Jeffrey Epstein; Ghislaine Maxwell; Trump,1190
Barack Obama,Virginia Giuffre,6,United States Of America; Hillary Clinton; Alan Dershowitz; Jeffrey Epstein; Ghislaine Maxwell; Trump,1188
Virginia Giuffre,David Rodriguez,9,Alberto Pinto; Sarah Kellen; Hillary Clinton; Gwendolyn Beck; Alan Dershowitz; Eva Dubin; Jeffrey Epstein; Ghislaine Maxwell; Trump,1188
Hillary Clinton,Gary Roxburgh,7,Andrea Mitrovich; Sarah Kellen; Shelley Lewis; Virginia Giuffre; Cindy Lopez (Buklarewicz); Jeffrey Epstein; Ghislaine Maxwell,1183
Trump,Bill Hammond,4,Larry Visoski; Jeffrey Epstein; Ghislaine Maxwell; Larry Summers,1180
Bradley Edwards,Joseph Recarey,10,underage girl; Sarah Kellen; Jeffrey S. Pagliuca; Alfredo Rodriguez; Palm Beach Police Department; Sigrid McCawley; Court; Alan Dershowitz; Jeffrey Epstein; Ghislaine Maxwell,1180
Virginia Giuffre,Damian Williams,10,Alison J. Nathan; Sarah Ransome; Jane Kate; Jeffrey S. Pagliuca; Laura Menninger; Bradley Edwards; Jeffrey Epstein; Elizabeth Stein; Ghislaine Maxwell; Jack Scarola,1180
Alison J. Nathan,Lesley Groff,8,Juan Alessi; Darren K. Indyke; Michelle Michelle; Bradley Edwards; Richard Kahn; Jeffrey Epstein; Ghislaine Maxwell; Eva Dubin,1176
Lesley Groff,"Andrew, Duke of York",12,Boris Nikolic; Nadia Marcinkova; underage girl; Juan Alessi; Sarah Kellen; Larry Visoski; Bradley Edwards; Richard Kahn; Hillary Clinton; Jeffrey Epstein,1176
Trump,Laura Poitras,4,United States Of America; Edward Snowden; Jeffrey Epstein; The Cincinnati Post,1172
Trump,Shelley Lewis,4,David Rodriguez; Jeffrey Epstein; Hillary Clinton; Ghislaine Maxwell,1172
Barack Obama,Desiree Washington,9,Syria; Vladimir Putin; Iran; North Korea; Egypt; China; Hillary Clinton; Ehud Barak; long-range rockets to Hamas,1170
Virginia Giuffre,Alexander Acosta,9,James Patterson; Jeffrey Epstein's lawyer; Palm Beach Police Department; Miami Herald Media Company; Bradley Edwards; Alan Dershowitz; Jeffrey Epstein; Ghislaine Maxwell; Trump,1170
Trump,Tatiana Kovylina,4,Larry Visoski; Jeffrey Epstein; Ghislaine Maxwell; Alan Dershowitz,1168
Trump,Clare Hazell-Iveagh,4,Jeffrey Epstein; Ghislaine Maxwell; Didier Cazaudumec; Alan Dershowitz,1168
Trump,Tim Ferriss,4,Japan; Jeffrey Epstein; California; United States Of America,1168
Steve Bannon,Lesley Groff,8,Boris Nikolic; Peter Thiel; United States Of America; Richard Kahn; Larry Summers; Jeffrey Epstein; Nicholas Ribis; Trump,1168
Jean-Luc Brunel,Lesley Groff,11,Boris Nikolic; underage girl; Nadia Marcinkova; Darren K. Indyke; Sarah Kellen; Larry Visoski; Michelle Michelle; Nicole Junkermann; Bradley Edwards; Jeffrey Epstein,1166
Trump,Harvard University,4,Jeffrey Epstein; Joi Ito; Supreme Court; Alan Dershowitz,1164
Trump,Robert Glassman,4,Jeffrey Epstein; Bradley Edwards; Ghislaine Maxwell; Jack Scarola,1164
Hillary Clinton,long-range rockets to Hamas,7,Barack Obama; Iran; Desiree Washington; Hafez al-Assad; Ehud Barak; Israel; Benjamin Netanyahu,1162
Barack Obama,Noam Chomsky,9,Joscha Bach; Lawrence Krauss; Iran; United States Of America; Trump; Alan Dershowitz; Ehud Barak; Jeffrey Epstein; Strange Bedfellows Episode 1,1161
Hillary Clinton,Farmer,7,Virginia Giuffre; Bradley Edwards; Sigrid McCawley; Alan Dershowitz; Jeffrey Epstein; Ghislaine Maxwell; unknown minor,1155
Alan Dershowitz,Alexander Rossmiller,6,Laura Menninger; Sigrid McCawley; David Boies; Martin Weinberg; Jeffrey Epstein; Ghislaine Maxwell,1152
Hillary Clinton,Jeffrey S. Pagliuca,6,Casey/Caroline; Virginia Giuffre; Bradley Edwards; Sigrid McCawley; Jeffrey Epstein; Ghislaine Maxwell,1152
Emmy Tayler,Nadia Marcinkova,10,"Jean-Luc Brunel; Gary Blackwell (Pilot); Sarah Kellen; Andrew, Duke of York; Gary Roxburgh; Alan Dershowitz; Jeffrey Epstein; Ghislaine Maxwell; Teala Davies; Eva Dubin",1150
United States Of America,Darren K. Indyke,7,Kathryn Ruemmler; Hillary Clinton; Alan Dershowitz; Lesley Groff; Jeffrey Epstein; Ghislaine Maxwell; Trump,1148
Hillary Clinton,Jared Kushner,6,United States invasion and occupation of Iraq; Richard Kahn; Michael Wolff; Larry Summers; Jeffrey Epstein; Trump,1140
United States Of America,long-range rockets to Hamas,8,Barack Obama; Iran; Saudi American Bank; Egypt; Qatar; Ehud Barak; Israel; Benjamin Netanyahu,1136
Hillary Clinton,Bill Hammond,7,Andrea Mitrovich; Sarah Kellen; Larry Visoski; Jeffrey Epstein; Adriana Ross; Ghislaine Maxwell; Larry Summers,1134
Barack Obama,Larry Visoski,7,Larry Summers; Hillary Clinton; Alan Dershowitz; Ehud Barak; Jeffrey Epstein; Ghislaine Maxwell; Trump,1134
Alan Dershowitz,Vladimir Putin,6,Barack Obama; United States Of America; Federal Bureau of Investigation Forensics Laboratory; Michael Wolff; Jeffrey Epstein; Trump,1128
Hillary Clinton,Laura Menninger,6,"Virginia Giuffre; Andrew, Duke of York; Sigrid McCawley; Alan Dershowitz; Jeffrey Epstein; Ghislaine Maxwell",1128
Hillary Clinton,Ariel Sharon,7,Yasser Arafat; Shlomo Ben-Ami; Shimon Peres; Benjamin Netanyahu; Ehud Barak; Israel; Yasir Arafat,1127
United States Of America,Sigrid McCawley,7,Virginia Giuffre; Paul Cassell; Bradley Edwards; Hillary Clinton; Alan Dershowitz; Jeffrey Epstein; Ghislaine Maxwell,1127
Barack Obama,Lesley Groff,7,United States Of America; Hillary Clinton; Larry Summers; Lawrence Krauss; Jeffrey Epstein; Ghislaine Maxwell; Trump,1127
Barack Obama,Hezbollah,9,Unknown Israeli political leader; Syria; Iran; Bashar al-Assad; Shimon Peres; Ehud Barak; Kingdom of Saudi Arabia; Israel; long-range rockets to Hamas,1125
Sarah Kellen,Palm Beach Police Department,9,Nadia Marcinkova; underage girl; Joseph Recarey; Virginia Giuffre; Alfredo Rodriguez; Bradley Edwards; Alan Dershowitz; Jeffrey Epstein; Ghislaine Maxwell,1125
Bradley Edwards,Bobbi C. Sternheim,9,Alison J. Nathan; Maurene Ryan Coney; Jeffrey S. Pagliuca; Lara Elizabeth Pomerantz; Damian Williams; Andrew Rohrbach; Sigrid McCawley; Jeffrey Epstein; Ghislaine Maxwell,1125
Richard Kahn,Alexander Acosta,11,Jane Does; U.S. Department of Justice (DOJ); Jay Lefkowitz; Harry Beller; Bradley Edwards; Alan Dershowitz; Trump administration; Martin Weinberg; Jeffrey Epstein; Ghislaine Maxwell,1122
Alan Dershowitz,Nsa,6,Barack Obama; United States Of America; House Judiciary Committee; Federal Bureau of Investigation Forensics Laboratory; Ronald Reagan; Jeffrey Epstein,1116
Alan Dershowitz,Andrea Mitrovich,6,Nadia Marcinkova; Sarah Kellen; Larry Visoski; Hillary Clinton; Jeffrey Epstein; Ghislaine Maxwell,1116
Hillary Clinton,Federal Bureau of Investigation Forensics Laboratory,6,Virginia Giuffre; Paul Krassner; Christopher Steele; Alan Dershowitz; Jeffrey Epstein; Trump,1116
Bradley Edwards,Christian R. Everdell,9,Alison J. Nathan; Maurene Ryan Coney; Jeffrey S. Pagliuca; Lara Elizabeth Pomerantz; Damian Williams; Andrew Rohrbach; Sigrid McCawley; Jeffrey Epstein; Ghislaine Maxwell,1116
Alan Dershowitz,Gary Roxburgh,6,Nadia Marcinkova; Sarah Kellen; Virginia Giuffre; Jeffrey Epstein; Emmy Tayler; Ghislaine Maxwell,1110
Virginia Giuffre,Bobbi C. Sternheim,9,Bill Cosby; Alison J. Nathan; Sarah Ransome; Jeffrey S. Pagliuca; Laura Menninger; Sigrid McCawley; Jeffrey Epstein; Elizabeth Stein; Ghislaine Maxwell,1107
Hillary Clinton,David Copperfield,7,Darren K. Indyke; Virginia Giuffre; Leslie Wexner; Bradley Edwards; Ehud Barak; Jeffrey Epstein; Ghislaine Maxwell,1106
Hillary Clinton,Hezbollah,7,Unknown Israeli political leader; Syria; Iran; Bashar al-Assad; Shimon Peres; Ehud Barak; Israel,1106
Sarah Kellen,Sophie Biddle,8,Joel Pashcow; David Rodriguez; Emmy Tayler; Gary Roxburgh; Jeffrey Epstein; Paula Epsilon; Ghislaine Maxwell; Eva Dubin,1104
Iran,United States Congress,11,Barack Obama; United States Of America; Syrian opposition; Michael Cembalest; Kingdom of Saudi Arabia; Robert Gates; Ehud Barak; Jeffrey Epstein; George H.W. Bush; Benjamin Netanyahu,1100
Alan Dershowitz,Former Senator George Mitchell,6,Barack Obama; David Rodriguez; White House; Leslie Wexner; Jeffrey Epstein; Ghislaine Maxwell,1098
Alison J. Nathan,Susan Elizabeth Brune,8,"Theresa Trzaskoma; William H. Pauley, III; David K. Parse; Sterntheim; Richard Kahn; David Boies; Jeffrey Epstein; Ghislaine Maxwell",1096
Alan Dershowitz,Bashar al-Assad,6,Barack Obama; White House; United States Of America; Hillary Clinton; Israel; Ehud Olmert,1092
Reid Weingarten,Laura Menninger,12,Richard Berman; Alison J. Nathan; Maurene Ryan Coney; Alexander Rossmiller; David Oscar Markus; Audrey Strauss; Christian R. Everdell; Jeffrey S. Pagliuca; Court; Jeffrey Epstein,1092
Bradley Edwards,Michael Wolff,8,"James Patterson; Andrew, Duke of York; Hillary Clinton; Richard Kahn; Alan Dershowitz; Jeffrey Epstein; Ghislaine Maxwell; Trump",1088
Alan Dershowitz,Teala Davies,6,Nadia Marcinkova; Sarah Kellen; Larry Visoski; Jeffrey Epstein; Emmy Tayler; Ghislaine Maxwell,1086
Bradley Edwards,Emmy Tayler,7,"Jean-Luc Brunel; Sarah Kellen; Virginia Giuffre; Andrew, Duke of York; Alan Dershowitz; Jeffrey Epstein; Ghislaine Maxwell",1085
Richard Kahn,Larry Summers,10,Jared Kushner; Eric Roth; Steve Bannon; Larry Visoski; Hillary Clinton; Alan Dershowitz; Lesley Groff; Jeffrey Epstein; Ghislaine Maxwell; Trump,1080
Barack Obama,David Rodriguez,7,Larry Summers; Hillary Clinton; Alan Dershowitz; Former Senator George Mitchell; Jeffrey Epstein; Ghislaine Maxwell; Trump,1078
United States Of America,Palestinians,8,Unknown Israeli political leader; Barack Obama; Shimon Peres; Hillary Clinton; Yitzhak Rabin; Ehud Barak; Israel; Benjamin Netanyahu,1072
Barack Obama,Federal Bureau of Investigation Forensics Laboratory,7,Vladimir Putin; Nsa; Paul Krassner; Alan Dershowitz; Edward Snowden; Jeffrey Epstein; Trump,1071
Alan Dershowitz,Lynn Forester,6,David Rodriguez; Mandy Ellison; Celina Midelfart; Jeffrey Epstein; Ghislaine Maxwell; Larry Summers,1068
Hillary Clinton,Gwendolyn Beck,6,David Rodriguez; Sarah Kellen; Virginia Giuffre; Jeffrey Epstein; Ghislaine Maxwell; Larry Summers,1068
Ehud Barak,Russia,8,Barack Obama; Syria; Vladimir Putin; Iran; United States Of America; Tom Barrack; China; Jeffrey Epstein,1064
Alan Dershowitz,Al Gore,6,Jeffrey Epstein's residence; Virginia Giuffre; Jeffrey Epstein; Ghislaine Maxwell; media organizations; Larry Summers,1062
Hillary Clinton,Jay Lefkowitz,6,David Schoen; Kenneth Starr; Richard Kahn; Alan Dershowitz; Jeffrey Epstein; Ghislaine Maxwell,1062
Richard Kahn,Reid Weingarten,10,Alison J. Nathan; Mike Pence; Steve Bannon; New York Times; Chris Christie; Martin Weinberg; Jeffrey Epstein; Michael Cohen; Ghislaine Maxwell; Trump,1060
Eva Dubin,"Andrew, Duke of York",10,Nadia Marcinkova; Alexia Wallert; Sarah Kellen; Virginia Giuffre; Larry Visoski; Larry Morrison; Jeffrey Epstein; Emmy Tayler; Ghislaine Maxwell; Trump,1060
Ghislaine Maxwell,Nsa,3,Barack Obama; Jeffrey Epstein; United States Of America,1059
Ghislaine Maxwell,House Judiciary Committee,3,Trump; Jeffrey Epstein; Alan Dershowitz,1056
Alan Dershowitz,David Mullen,6,Nadia Marcinkova; Sarah Kellen; Larry Visoski; Adriana Ross; Jeffrey Epstein; Ghislaine Maxwell,1056
Hillary Clinton,Edward Snowden,5,Barack Obama; United States Of America; Jeffrey Epstein; Israel; Trump,1055
Ghislaine Maxwell,Egypt,3,Barack Obama; Ehud Barak; United States Of America,1053
Emmy Tayler,Larry Visoski,9,"Jean-Luc Brunel; Larry Summers; Sarah Kellen; Andrew, Duke of York; Alan Dershowitz; Jeffrey Epstein; Ghislaine Maxwell; Teala Davies; Eva Dubin",1053
Alan Dershowitz,Valdson Cotrin,6,Nadia Marcinkova; Sarah Kellen; Larry Visoski; Adriana Ross; Tatiana Kovylina; Jeffrey Epstein,1050
Alan Dershowitz,Unknown Israeli political leader,6,Barack Obama; United States Of America; Hillary Clinton; David Ben-Gurion; Yitzhak Rabin; Ehud Olmert,1050
Emmy Tayler,Larry Morrison,10,"Jean-Luc Brunel; Jonathan Mano; Sarah Kellen; Andrew, Duke of York; Gary Roxburgh; Larry Summers; Jeffrey Epstein; Ghislaine Maxwell; Teala Davies; Eva Dubin",1050
Larry Summers,"Andrew, Duke of York",11,Sarah Kellen; Leslie Wexner; Jes Staley; Larry Visoski; Hillary Clinton; Alan Dershowitz; Larry Morrison; Jeffrey Epstein; Emmy Tayler; Ghislaine Maxwell,1045
Alan Dershowitz,Natalya Malyshov,6,Nadia Marcinkova; Sarah Ransome; Sarah Kellen; Larry Visoski; Jeffrey Epstein; Ghislaine Maxwell,1044
Alan Dershowitz,Robert Glassman,6,Laura Menninger; Bradley Edwards; Sigrid McCawley; Jeffrey Epstein; Ghislaine Maxwell; Jack Scarola,1044
United States Of America,Jean-Luc Brunel,6,MC2 modeling agency; Virginia Giuffre; Bradley Edwards; Ehud Barak; Jeffrey Epstein; Ghislaine Maxwell,1044
United States Of America,New York Times,7,Harry Reems; Alan Dershowitz; Edward Snowden; Reid Weingarten; Jeffrey Epstein; Glenn Greenwald; Trump,1043
Barack Obama,U.S. Department of Justice (DOJ),7,White House; Nsa; Kathryn Ruemmler; Edward Snowden; Jeffrey Epstein; United States Congress; Trump,1043
Ghislaine Maxwell,James Comey,3,Tom Pritzker; Jeffrey Epstein; Trump,1041
Barack Obama,Mohammed bin Salman,8,White House; Syria; United States Of America; Kingdom of Saudi Arabia; Osama bin Laden; Jeffrey Epstein; George H.W. Bush; Trump,1040
Ghislaine Maxwell,Trump administration,3,Jeffrey Epstein; Richard Kahn; Alexander Acosta,1038
Ghislaine Maxwell,Osama bin Laden,3,Barack Obama; United States Attorney's Office; United States Of America,1038
United States Of America,Jack Scarola,7,Virginia Giuffre; Paul Cassell; Bradley Edwards; Alan Dershowitz; Jeffrey Epstein; Ghislaine Maxwell; Trump,1036
Ghislaine Maxwell,Associate Warden,3,Richard Berman; Jeffrey Epstein; Chief Psychologist,1035
Ghislaine Maxwell,Robert Mueller,3,Reid Weingarten; Jeffrey Epstein; Trump,1032
Ghislaine Maxwell,The Cincinnati Post,3,Larry Summers; Jeffrey Epstein; Trump,1032
Ghislaine Maxwell,Glenn Greenwald,3,State Of New York; Barack Obama; United States Of America,1029
Ghislaine Maxwell,Turkey,3,Jeffrey Epstein; Hillary Clinton; United States Of America,1029
Ghislaine Maxwell,CIA/BoozAllen,3,Cathy; Dominique Strauss-Kahn; Trump,1026
Ghislaine Maxwell,Unknown Israeli political leader,3,Barack Obama; Hillary Clinton; United States Of America,1026
Ghislaine Maxwell,David Benhamou,3,David K. Parse; Theresa Trzaskoma; Susan Elizabeth Brune,1026
Ghislaine Maxwell,Ehud Olmert,3,Ehud Barak; Jeffrey Epstein; Alan Dershowitz,1026
Bradley Edwards,"Jane, Annie, Kate, Carolyn, Virginia, and Melissa",9,Alison J. Nathan; Maurene Ryan Coney; Jeffrey S. Pagliuca; Lara Elizabeth Pomerantz; Damian Williams; Andrew Rohrbach; Jeffrey Epstein; Ghislaine Maxwell; Robert Glassman,1026
Virginia Giuffre,Larry Morrison,8,"Jean-Luc Brunel; Sarah Kellen; Andrew, Duke of York; Gary Roxburgh; Bradley Edwards; Jeffrey Epstein; Ghislaine Maxwell; Eva Dubin",1024
Ghislaine Maxwell,Palestinians,3,Barack Obama; Ehud Barak; Hillary Clinton,1023
Ghislaine Maxwell,Lee Plourde,3,Richard Berman; Jeffrey Epstein; Lamine N'DiayeLee Plourde,1023
Ghislaine Maxwell,James Petrucci,3,Richard Berman; Jeffrey Epstein; Lamine N'DiayeLee Plourde,1023
Barack Obama,Turkey,8,Syria; Iran; United States Of America; Syrian opposition; Dennis Ross; Hillary Clinton; Jeffrey Epstein; Israel,1016
Alan Dershowitz,China,5,Barack Obama; United States Of America; Trump; Jeffrey Epstein; Larry Summers,1015
Barack Obama,Sarah Kellen,5,Hillary Clinton; Alan Dershowitz; Jeffrey Epstein; Ghislaine Maxwell; Larry Summers,1015
"Andrew, Duke of York",Darren K. Indyke,11,Juan Alessi; Sarah Kellen; Larry Visoski; Hillary Clinton; Michael Wolff; Daily Mail Online; Alan Dershowitz; Richard Kahn; Jeffrey Epstein; Ghislaine Maxwell,1012
Hillary Clinton,David Boies,6,Virginia Giuffre; Bradley Edwards; Sigrid McCawley; Alan Dershowitz; Jeffrey Epstein; Ghislaine Maxwell,1008
United States Of America,David Boies,7,Virginia Giuffre; Paul Cassell; Bradley Edwards; Alan Dershowitz; Reid Weingarten; Jeffrey Epstein; Ghislaine Maxwell,1008
Sigrid McCawley,Damian Williams,14,Alison J. Nathan; Maurene Ryan Coney; Sarah Ransome; Christian R. Everdell; Jeffrey S. Pagliuca; Jack Scarola; Lara Elizabeth Pomerantz; Laura Menninger; Andrew Rohrbach; Bradley Edwards,1008
Hillary Clinton,Brent Tindall (Chef),6,Andrea Mitrovich; Sarah Kellen; Cindy Lopez (Buklarewicz); Larry Visoski; Jeffrey Epstein; Ghislaine Maxwell,1002
Alan Dershowitz,Susan Elizabeth Brune,5,Ms.Villaflana; Richard Kahn; David Boies; Jeffrey Epstein; Ghislaine Maxwell,1000
Steve Bannon,New York Times,8,"Jared Kushner; House Judiciary Committee; Michael Wolff; Rosenstein, Rob; Richard Kahn; Reid Weingarten; Jeffrey Epstein; Trump",1000
Ehud Barak,Richard Kahn,6,Boris Nikolic; Larry Visoski; Hillary Clinton; Noam Chomsky; Jeffrey Epstein; Ghislaine Maxwell,996
Sarah Kellen,Jeffrey S. Pagliuca,7,Juan Alessi; Virginia Giuffre; Joseph Recarey; Bradley Edwards; Jeffrey Epstein; Ghislaine Maxwell; Eva Dubin,994
Virginia Giuffre,Martin Weinberg,8,Richard Berman; Alison J. Nathan; Jeffrey S. Pagliuca; Federal Bureau of Investigation Forensics Laboratory; Alan Dershowitz; Jeffrey Epstein; Ghislaine Maxwell; media organizations,992
Jean-Luc Brunel,Andrea Mitrovich,12,Nadia Marcinkova; Brent Tindall (Chef); Sarah Kellen; Cindy Lopez (Buklarewicz); Susan Hamblin; Larry Visoski; Dana Burns; David Mullen; Larry Morrison; Jeffrey Epstein,984
United States Of America,media organizations,7,Virginia Giuffre; Steve Bannon; Alan Dershowitz; Edward Snowden; Jeffrey Epstein; Ghislaine Maxwell; Trump,980
Alison J. Nathan,Paul Cassell,7,Virginia Giuffre; Bradley Edwards; Sigrid McCawley; David Boies; Jeffrey Epstein; Ghislaine Maxwell; Jack Scarola,980
Laura Menninger,Paul Cassell,11,"Jeffery Pagliuca; Nicole Simmons; Virginia Giuffre; Robert W. Sweet; Andrew, Duke of York; Sigrid McCawley; Court; Alan Dershowitz; Aldrich; Jeffrey Epstein",979
Hillary Clinton,Mohammed bin Salman,6,Yasser Arafat; Syria; United States Of America; Michael Wolff; Jeffrey Epstein; Trump,978
United States Of America,David Rodriguez,6,Larry Summers; Hillary Clinton; Alan Dershowitz; Jeffrey Epstein; Ghislaine Maxwell; Trump,978
United States Of America,Mark Epstein,7,Vladimir Putin; Bradley Edwards; Larry Summers; Lesley Groff; Jeffrey Epstein; Ghislaine Maxwell; Trump,973
Sarah Kellen,Michael Wolff,7,"Darren K. Indyke; Andrew, Duke of York; Hillary Clinton; Alan Dershowitz; Jeffrey Epstein; Ghislaine Maxwell; media organizations",973
Alan Dershowitz,Bobbi C. Sternheim,5,Sarah Ransome; Laura Menninger; Sigrid McCawley; Jeffrey Epstein; Ghislaine Maxwell,970
Lesley Groff,Michael Wolff,10,Darren K. Indyke; Elisa New; Deepak Chopra; Hillary Clinton; Richard Kahn; Ghislaine Maxwell; Lawrence Krauss; Jeffrey Epstein; Nicholas Ribis; Trump,970
Bradley Edwards,Jack Goldberger,8,Jane Does; Sarah Kellen; Virginia Giuffre; Scott W. Rothstein; Alan Dershowitz; Epstein civil litigation cases; Jeffrey Epstein; Jack Scarola,968
Reid Weingarten,Sigrid McCawley,11,Richard Berman; Alison J. Nathan; Maurene Ryan Coney; Alexander Rossmiller; Christian R. Everdell; Jeffrey S. Pagliuca; Stanley Pottinger; Court; David Boies; Jeffrey Epstein,968
Sarah Kellen,Laura Menninger,7,"Virginia Giuffre; Joseph Recarey; Andrew, Duke of York; Court; Alan Dershowitz; Jeffrey Epstein; Ghislaine Maxwell",966
Alan Dershowitz,Christian R. Everdell,5,Laura Menninger; Sigrid McCawley; Martin Weinberg; Jeffrey Epstein; Ghislaine Maxwell,965
Hillary Clinton,Richard Berman,5,Virginia Giuffre; John Sullivan; Sigrid McCawley; Jeffrey Epstein; Ghislaine Maxwell,965
Iran,Larry Summers,9,Barack Obama; United States Of America; Michael Cembalest; China; Kingdom of Saudi Arabia; Hillary Clinton; Ehud Barak; Jeffrey Epstein; Trump,963
Laura Menninger,Jack Scarola,13,"Alison J. Nathan; Maurene Ryan Coney; Virginia Giuffre; Lara Elizabeth Pomerantz; Damian Williams; Andrew Rohrbach; Andrew, Duke of York; Sigrid McCawley; Court; Alan Dershowitz",962
Hillary Clinton,David Mullen,6,Andrea Mitrovich; Sarah Kellen; Larry Visoski; Jeffrey Epstein; Adriana Ross; Ghislaine Maxwell,960
Hillary Clinton,Jeffrey Epstein's residence,6,Virginia Giuffre; Kathryn Ruemmler; Michael Wolff; Alan Dershowitz; Ghislaine Maxwell; Trump,960
Steve Bannon,Syria,8,White House; Russia; United States Of America; Desiree Washington; China; Kingdom of Saudi Arabia; Benjamin Netanyahu; Trump,960
Sophie Biddle,Gwendolyn Beck,12,David Rodriguez; Joel Pashcow; Robin Plant; Tiffany Gramza; Celina Midelfart; Patricia Cayne; Anthony Barrett; Jim Cayne; Jeffrey Epstein; Emmy Tayler,960
Reid Weingarten,Lara Elizabeth Pomerantz,11,Richard Berman; Alison J. Nathan; Maurene Ryan Coney; Alexander Rossmiller; David Oscar Markus; Audrey Strauss; Christian R. Everdell; Jeffrey S. Pagliuca; Jeffrey Epstein; Mark Stewart Cohen,957
Hillary Clinton,Xi Jinping,6,Barack Obama; United States Of America; Joe Biden; California; Jeffrey Epstein; Trump,954
Hillary Clinton,Tatiana Kovylina,6,Sarah Kellen; Larry Visoski; Alan Dershowitz; Jeffrey Epstein; Adriana Ross; Ghislaine Maxwell,954
Hillary Clinton,Valdson Cotrin,6,Andrea Mitrovich; Sarah Kellen; Larry Visoski; Adriana Ross; Lesley Groff; Jeffrey Epstein,954
Richard Kahn,Eva Dubin,8,Alison J. Nathan; Darren K. Indyke; Larry Visoski; Lesley Groff; Natalie; Jeffrey Epstein; Ghislaine Maxwell; Trump,952
Trump,Susan Elizabeth Brune,3,Ghislaine Maxwell; Jeffrey Epstein; Richard Kahn,951
Israel,Unknown Israeli political leader,13,Barack Obama; Iran; United States Of America; Palestinians; Shimon Peres; Kingdom of Saudi Arabia; Hillary Clinton; David Ben-Gurion; Yitzhak Rabin; Hezbollah,949
Bradley Edwards,Edward Snowden,6,United States Attorney's Office; United States Attorney Southern District of Florida; United States Of America; U.S. Department of Justice (DOJ); Jeffrey Epstein; Trump,948
Richard Berman,Andrew Rohrbach,12,Alison J. Nathan; Maurene Ryan Coney; Alexander Rossmiller; Christian R. Everdell; Audrey Strauss; Jeffrey S. Pagliuca; Lara Elizabeth Pomerantz; Laura Menninger; Sigrid McCawley; Jeffrey Epstein,948
Barack Obama,Leslie Wexner,7,Larry Summers; Hillary Clinton; Alan Dershowitz; Former Senator George Mitchell; Jeffrey Epstein; Ghislaine Maxwell; Trump,945
Bradley Edwards,Elizabeth Stein,9,Farmer; Alison J. Nathan; Maurene Ryan Coney; Virginia Giuffre; Lara Elizabeth Pomerantz; Damian Williams; Andrew Rohrbach; Jeffrey Epstein; Ghislaine Maxwell,945
Israel,Larry Summers,9,Barack Obama; United States Of America; Kingdom of Saudi Arabia; Jes Staley; Hillary Clinton; Alan Dershowitz; Ehud Barak; Jeffrey Epstein; Trump,945
Sarah Kellen,Leslie Wexner,8,"Virginia Giuffre; Andrew, Duke of York; Bradley Edwards; Hillary Clinton; Alan Dershowitz; Jeffrey Epstein; Ghislaine Maxwell; Larry Summers",944
Barack Obama,"Andrew, Duke of York",6,Clarisse Thorn; Hillary Clinton; Alan Dershowitz; Jeffrey Epstein; Ghislaine Maxwell; Trump,942
Larry Summers,Michael Wolff,10,Jared Kushner; Tom Barrack; Steve Bannon; Elisa New; Kingdom of Saudi Arabia; Hillary Clinton; Alan Dershowitz; Jeffrey Epstein; Ghislaine Maxwell; Trump,940
Bradley Edwards,David Rodriguez,7,Sarah Kellen; Mark Epstein; Hillary Clinton; Alan Dershowitz; Jeffrey Epstein; Ghislaine Maxwell; Trump,938
