entity_a,entity_b,shared_neighbor_count,shared_neighbors,priority_score
Virginia Giuffre,Edward Snowden,6,United States Of America; United States Attorney Southern District of Florida; Federal Bureau of Investigation Forensics Laboratory; Jeffrey Epstein; media organizations; Trump,936
Larry Visoski,Gary Roxburgh,12,Nadia Marcinkova; Eva Dubin; Andrea Mitrovich; Brent Tindall (Chef); Sarah Kellen; Natalya Malyshov; Jennifer Kalin; Larry Morrison; Jeffrey Epstein; Ghislaine Maxwell,936
Bradley Edwards,Federal Bureau of Investigation Forensics Laboratory,7,Jean-Luc Brunel; Virginia Giuffre; Alfredo Rodriguez; Palm Beach Police Department; Alan Dershowitz; Jeffrey Epstein; Trump,931
Trump,Christian R. Everdell,3,Reid Weingarten; Jeffrey Epstein; Ghislaine Maxwell,930
Alan Dershowitz,Russia,5,Barack Obama; United States Of America; Jeffrey Epstein; Julian Assange; Trump,930
Barack Obama,Darren K. Indyke,6,Kathryn Ruemmler; Hillary Clinton; Alan Dershowitz; Jeffrey Epstein; Ghislaine Maxwell; Trump,930
Bradley Edwards,Kenneth Starr,8,plea agreement; U.S. Department of Justice (DOJ); United States Attorney Southern District of Florida; Hillary Clinton; Alan Dershowitz; Jeffrey Epstein; Alexander Acosta; Trump,928
Trump,Alexander Rossmiller,3,Reid Weingarten; Jeffrey Epstein; Ghislaine Maxwell,927
Trump,David K. Parse,3,Ghislaine Maxwell; Preet Bharara; Jack Scarola,927
Alan Dershowitz,Yasser Arafat,5,United States Of America; Hillary Clinton; Yitzhak Rabin; Israel; Benjamin Netanyahu,925
Jean-Luc Brunel,Adriana Ross,12,Nadia Marcinkova; underage girl; Sarah Kellen; Susan Hamblin; Larry Visoski; court deposition; Dana Burns; Bradley Edwards; David Mullen; Larry Morrison,924
Alan Dershowitz,Egypt,5,Barack Obama; United States Of America; Mahmoud Ahmadinejad; David Ben-Gurion; Israel,920
Hillary Clinton,Susan Elizabeth Brune,5,"William H. Pauley, III; Catherine Morgan Conrad; Richard Kahn; Jeffrey Epstein; Ghislaine Maxwell",920
United States Of America,Emmy Tayler,5,Virginia Giuffre; Alan Dershowitz; Jeffrey Epstein; Ghislaine Maxwell; Larry Summers,920
Edward Snowden,Jared Kushner,8,China; The Cincinnati Post; CIA/BoozAllen; House Judiciary Committee; Federal Bureau of Investigation Forensics Laboratory; New York Times; Jeffrey Epstein; Trump,920
Richard Kahn,Jean-Luc Brunel,8,Boris Nikolic; U.S. Department of Justice (DOJ); Darren K. Indyke; Larry Visoski; Bradley Edwards; Natalie; Jeffrey Epstein; Ghislaine Maxwell,920
Alan Dershowitz,Cindy Lopez (Buklarewicz),5,David Rodriguez; Sarah Kellen; Hillary Clinton; Jeffrey Epstein; Ghislaine Maxwell,915
Alan Dershowitz,Brent Tindall (Chef),5,Nadia Marcinkova; Sarah Kellen; Larry Visoski; Jeffrey Epstein; Ghislaine Maxwell,915
Steve Bannon,Virginia Giuffre,5,United States Of America; Charlie Rose; Jeffrey Epstein; media organizations; Trump,915
United States Of America,Paul Krassner,6,Barack Obama; Vladimir Putin; Hillary Clinton; Jeffrey Epstein; George H.W. Bush; Trump,912
Steve Bannon,Israel,6,United States Of America; Europe; Kingdom of Saudi Arabia; Jeffrey Epstein; Benjamin Netanyahu; Trump,912
Sarah Kellen,Mandy Ellison,8,Joel Pashcow; Gwendolyn Beck; Alan Dershowitz; Eva Dubin; Jeffrey Epstein; Emmy Tayler; Ghislaine Maxwell; Larry Summers,912
Alison J. Nathan,Jay Lefkowitz,7,Richard Berman; David Oscar Markus; Laura Menninger; Richard Kahn; Martin Weinberg; Jeffrey Epstein; Ghislaine Maxwell,910
Lesley Groff,Larry Morrison,10,Nadia Marcinkova; Valdson Cotrin; Sarah Kellen; Larry Visoski; Bradley Edwards; Larry Summers; Adriana Ross; Jeffrey Epstein; Ghislaine Maxwell; Eva Dubin,910
Jeffrey S. Pagliuca,Sarah Ransome,13,Farmer; Alison J. Nathan; Maurene Ryan Coney; Jane Kate; Virginia Giuffre; Lara Elizabeth Pomerantz; Damian Williams; Andrew Rohrbach; Sigrid McCawley; David Boies,910
Edward Snowden,Paul Krassner,9,Barack Obama; Vladimir Putin; Aclu; The Cincinnati Post; House Judiciary Committee; Federal Bureau of Investigation Forensics Laboratory; New York Times; Jeffrey Epstein; Trump,909
United States Of America,Palm Beach Police Department,6,Virginia Giuffre; Paul Cassell; Bradley Edwards; Alan Dershowitz; Jeffrey Epstein; Ghislaine Maxwell,906
Ehud Barak,Darren K. Indyke,6,Jean-Luc Brunel; Larry Visoski; Hillary Clinton; Ghislaine Maxwell; Jeffrey Epstein; David Copperfield,906
Alison J. Nathan,Jean-Luc Brunel,6,Darren K. Indyke; Virginia Giuffre; Michelle Michelle; Bradley Edwards; Jeffrey Epstein; Ghislaine Maxwell,906
Trump,Barry Krischer,3,Jeffrey Epstein; Kenneth Starr; Alan Dershowitz,900
